{
    "name": "GOBLIN WARRIOR",
    "level": 1,
    "roles": [
        "HORDE",
        "HARRIER"
    ],
    "ancestry": [
        "Goblin",
        "Humanoid"
    ],
    "ev": "3",
    "stamina": 15,
    "speed": "6 (climb)",
    "size": "1S",
    "stability": 0,
    "free_strike": 1,
    "might": -2,
    "agility": 2,
    "reason": 0,
    "intuition": 0,
    "presence": -1,
    "immunities": [],
    "traits": [
        {
            "name": "Crafty",
            "effect": "The warrior doesnâ€™t provoke opportunity attacks by moving."
        }
    ],
    "abilities": [
        {
            "name": "Spear Charge",
            "type": "Action",
            "keywords": [
                "Charge",
                "Melee",
                "Strike",
                "Weapon"
            ],
            "effects": [
                {
                    "roll": "2d10 + 2",
                    "11 or lower": "3 damage",
                    "12-16": "4 damage",
                    "17+": "5 damage"
                }
            ],
            "cost": "Signature",
            "distance": "Melee 1",
            "target": "One creature or object"
        },
        {
            "name": "Bury the Point",
            "type": "Action",
            "keywords": [
                "Melee",
                "Strike",
                "Weapon"
            ],
            "effects": [
                {
                    "roll": "2d10 + 2",
                    "11 or lower": "5 damage; M<0 bleeding (save ends)",
                    "12-16": "6 damage; M<1 bleeding (save ends)",
                    "17+": "7 damage; M<2 bleeding (save ends)"
                }
            ],
            "cost": "2 Malice",
            "distance": "Melee 1",
            "target": "One creature"
        }
    ]
}