{
    "name": "RADENWIGHT SWIFTPAW",
    "level": 1,
    "roles": [
        "MINION",
        "HARRIER"
    ],
    "ancestry": [
        "Humanoid",
        "Radenwight"
    ],
    "ev": "3 for four minions",
    "stamina": 4,
    "speed": "7 (climb)",
    "size": "1S",
    "stability": 0,
    "free_strike": 1,
    "with_captain": "Edge on strikes",
    "might": 0,
    "agility": 2,
    "reason": 1,
    "intuition": 0,
    "presence": -1,
    "immunities": [],
    "traits": [],
    "abilities": [
        {
            "name": "Rapier Flunge",
            "type": "Action",
            "keywords": [
                "Melee",
                "Strike",
                "Weapon"
            ],
            "effects": [
                {
                    "roll": "2d10 + 2",
                    "11 or lower": "1 damage; slide 1; shift 1",
                    "12-16": "2 damage; slide 2; shift 2",
                    "17+": "3 damage; slide 3; shift 3"
                }
            ],
            "cost": "Signature",
            "distance": "Melee 1",
            "target": "One creature or object per minion"
        },
        {
            "name": "Ready Rodent",
            "type": "Triggered Action",
            "keywords": [
                "Melee",
                "Weapon"
            ],
            "effects": [
                "The swiftpaw makes a free strike against the target."
            ],
            "distance": "Melee 1",
            "target": "One creature",
            "trigger": "An ally deals damage to the target."
        }
    ]
}