{
    "name": "RADENWIGHT MISCHIEVER",
    "level": 1,
    "roles": [
      "MINION",
      "AMBUSHER"
    ],
    "ancestry": [
      "Humanoid",
      "Radenwight"
    ],
    "ev": "3 for four minions",
    "stamina": 4,
    "speed": "7 (climb)",
    "size": "1S",
    "stability": 0,
    "free_strike": 2,
    "might": -1,
    "agility": 2,
    "reason": 0,
    "intuition": 1,
    "presence": 0,
    "with_captain": "Strike damage +1",
    "traits": [],
    "abilities": [
      {
        "name": "Dagger Dance",
        "type": "Action",
        "cost": "Signature",
        "keywords": [
          "Melee",
          "Strike",
          "Weapon"
        ],
        "distance": "Melee 1 or Ranged 5",
        "target": "One creature per minion",
        "effects": [
          {
            "roll": "2d10 + 2",
            "11 or lower": "2 damage",
            "12-16": "4 damage",
            "17+": "5 damage"
          },
          "If the mischiever is hidden when they use this ability, they can target two creatures."
        ]
      },
      {
        "name": "Ready Rodent",
        "type": "Triggered Action",
        "keywords": [
          "Melee",
          "Weapon"
        ],
        "distance": "Melee 1",
        "target": "One creature",
        "trigger": "An ally deals damage to the target.",
        "effects": [
          "The mischiever makes a free strike against the target."
        ]
      }
    ]
  }