{
    "name": "GHOUL",
    "level": 1,
    "roles": [
      "HORDE",
      "HARRIER"
    ],
    "ancestry": [
      "Undead"
    ],
    "ev": "3",
    "stamina": 15,
    "immunities": [
      "corruption 1",
      "poison 1"
    ],
    "speed": "7",
    "size": "1M",
    "stability": 0,
    "free_strike": 1,
    "might": 0,
    "agility": 2,
    "reason": -2,
    "intuition": 0,
    "presence": -1,
    "traits": [],
    "abilities": []
  }