{
    "name": "RADENWIGHT REDEYE",
    "level": 1,
    "roles": [
        "MINION",
        "ARTILLERY"
    ],
    "ancestry": [
        "Humanoid",
        "Radenwight"
    ],
    "ev": "3 for four minions",
    "stamina": 3,
    "speed": "5 (climb)",
    "size": "1S",
    "stability": 0,
    "free_strike": 2,
    "with_captain": "Edge on strikes",
    "might": 1,
    "agility": 2,
    "reason": -1,
    "intuition": 0,
    "presence": 0,
    "traits": [],
    "abilities": [
        {
            "name": "Eyes-On-Me Shot",
            "type": "Action",
            "keywords": [
                "Ranged",
                "Strike",
                "Weapon"
            ],
            "effects": [
                {
                    "roll": "2d10 + 2",
                    "11 or lower": "2 damage",
                    "12-16": "4 damage",
                    "17+": "5 damage"
                },
                "An ally of the redeye within 2 squares of the target can shift up to 2 squares."
            ],
            "cost": "Signature",
            "distance": "Ranged 10",
            "target": "One creature or object per minion"
        },
        {
            "name": "Ready Rodent",
            "type": "Triggered Action",
            "keywords": [
                "Melee",
                "Weapon"
            ],
            "effects": [
                "The redeye makes a free strike against the target."
            ],
            "distance": "Melee 1",
            "target": "One creature",
            "trigger": "An ally deals damage to the target."
        }
    ]
}