{
    "name": "GHOUL",
    "level": 1,
    "roles": [
        "HORDE",
        "HARRIER"
    ],
    "ancestry": [
        "Undead"
    ],
    "ev": "3",
    "stamina": 15,
    "speed": "7",
    "size": "1M",
    "stability": 0,
    "free_strike": 1,
    "might": 0,
    "agility": 2,
    "reason": -2,
    "intuition": 0,
    "presence": -1,
    "immunities": [
        "corruption 1",
        "poison 1"
    ],
    "traits": [
        {
            "name": "Hunger",
            "effect": "If the ghoul charges, their speed increases by 2 until the end of their turn."
        },
        {
            "name": "Arise",
            "effect": "The first time the ghoul is reduced to Stamina 0 by damage that isn’t fire damage or holy damage and their body isn’t destroyed, they regain 1 Stamina and fall prone."
        }
    ],
    "abilities": [
        {
            "name": "Razor Claws",
            "type": "Action",
            "keywords": [
                "Charge",
                "Melee",
                "Strike",
                "Weapon"
            ],
            "effects": [
                {
                    "roll": "2d10 + 2",
                    "11 or lower": "3 damage",
                    "12-16": "4 damage",
                    "17+": "5 damage; M<2 bleeding (save ends)"
                }
            ],
            "cost": "Signature",
            "distance": "Melee 1",
            "target": "One creature or object"
        },
        {
            "name": "Leap",
            "type": "Maneuver",
            "keywords": [
                "—"
            ],
            "effects": [
                "The ghoul jumps 3 squares. If they land on a size 1 enemy, that enemy is knocked prone and the ghoul makes a free strike against them."
            ],
            "distance": "Self",
            "target": "Self"
        }
    ]
}