{
    "name": "DWARF TRAPPER",
    "level": 1,
    "roles": [
        "PLATOON",
        "HARRIER"
    ],
    "ancestry": [
        "Dwarf",
        "Humanoid"
    ],
    "ev": "6",
    "stamina": 36,
    "speed": "7",
    "size": "1M",
    "stability": 2,
    "free_strike": 3,
    "might": 0,
    "agility": 2,
    "reason": 0,
    "intuition": 1,
    "presence": 0,
    "immunities": [],
    "traits": [],
    "abilities": [
        {
            "name": "Concussive Bolts",
            "type": "Action",
            "keywords": [
                "Charge",
                "Melee",
                "Ranged",
                "Strike",
                "Weapon"
            ],
            "effects": [
                {
                    "roll": "2d10 + 2",
                    "11 or lower": "5 damage; push 2",
                    "12-16": "7 damage; push 4",
                    "17+": "9 damage; push 6"
                },
                "A target restrained by a dwarf can be pushed by this ability."
            ],
            "cost": "Signature",
            "distance": "Melee 1 or Ranged 10",
            "target": "1 creature or object"
        },
        {
            "name": "Steam Powered Snare",
            "type": "Maneuver",
            "keywords": [
                "Area",
                "Ranged"
            ],
            "effects": [
                {
                    "roll": "Each target makes a Might test.",
                    "11 or lower": "7 damage; restrained (EoT)",
                    "12-16": "5 damage; slowed (EoT)",
                    "17+": "No effect"
                },
                "The snare remains until the end of the encounter. An enemy that moves into an affected square for the first time on their turn must make the test."
            ],
            "cost": "3 Malice",
            "distance": "3 cube within 5",
            "target": "All enemies in the cube"
        }
    ]
}