{
  "name": "GOBLIN ASSASSIN",
  "level": 1,
  "roles": [
    "HORDE",
    "AMBUSHER"
  ],
  "ancestry": [
    "Goblin",
    "Humanoid"
  ],
  "ev": "3",
  "stamina": 15,
  "speed": "6 (climb)",
  "size": "1S",
  "stability": 0,
  "free_strike": 2,
  "might": 0,
  "agility": 0,
  "reason": 0,
  "intuition": 0,
  "presence": 0,
  "traits": [],
  "abilities": []
}